{
  "compat": [
    {
      "aapt2": "1.0",
      "agp": "9.4.1",
      "buildTools": "1.0",
      "compileSdk": "36",
      "jdk": ">=17",
      "status": "untested"
    }
  ],
  "components": [
    {
      "arch": "any",
      "channel": "stable",
      "critical": true,
      "id": "test-tools",
      "installPath": "test-tools/1.0",
      "requires": [],
      "revision": "r1",
      "sha256": "0000000000000000000000000000000000000000000000000000000000000000",
      "size": 260,
      "sources": [
        {
          "url": "https://example.invalid/test-tools-1.0-r1-any.tar.xz"
        }
      ],
      "verify": {
        "cmd": "test-tools/1.0/hello.txt",
        "expect": "hello"
      },
      "version": "1.0"
    }
  ],
  "generatedAt": "2026-10-05T12:00:00Z",
  "profiles": {
    "default": {
      "components": [
        "test-tools@1.0"
      ]
    }
  },
  "schemaVersion": 2
}
